{
  "action_id": "action-valid-release",
  "content_digest": "sha256:75b836c6cdc999539f6b131632d120718b1cff12dc9799332f4632a9dd8f60d3",
  "created_at": "2026-07-01T00:00:00Z",
  "evidence_classes": [
    "unchecked_advisory"
  ],
  "external_ref_ids": [],
  "node_class": "runtime_action",
  "node_id": "node-runtime_action",
  "payload": null,
  "payload_ref": null,
  "pcs_claim_id": null,
  "privacy": "public",
  "schema_version": "v1",
  "summary": "runtime_action for action-valid-release"
}
