{
  "action_id": "action-pilot-retrospective",
  "content_digest": "sha256:798b8c967a63222dba6fe07a22efc55e4bb0351bbbab949aeda27b1d82685cd5",
  "created_at": "2026-07-01T00:00:00Z",
  "evidence_classes": [
    "human_reviewed"
  ],
  "external_ref_ids": [],
  "node_class": "grant",
  "node_id": "node-grant",
  "payload": null,
  "payload_ref": null,
  "pcs_claim_id": null,
  "privacy": "public",
  "schema_version": "v1",
  "summary": "grant for action-pilot-retrospective"
}
