{
  "action_id": "action-pilot-retrospective",
  "content_digest": "sha256:06e97bcf3a66d18cf10e5fc4ca56bc4d5c378a62e8893b29aaf17370c782e654",
  "created_at": "2026-07-01T00:00:00Z",
  "evidence_classes": [
    "human_reviewed"
  ],
  "external_ref_ids": [],
  "node_class": "review",
  "node_id": "node-review",
  "payload": null,
  "payload_ref": null,
  "pcs_claim_id": null,
  "privacy": "public",
  "schema_version": "v1",
  "summary": "review for action-pilot-retrospective"
}
