{
  "action_id": "action-pilot-retrospective",
  "content_digest": "sha256:4d3b6888fb4867ac749ed0bc66438d836131af1952cc243021d77964f64bd4a6",
  "created_at": "2026-07-01T00:00:00Z",
  "evidence_classes": [
    "human_reviewed"
  ],
  "external_ref_ids": [],
  "node_class": "calibration_update",
  "node_id": "node-calibration-cal-1",
  "payload": null,
  "payload_ref": "calibrations/cal-1.json",
  "pcs_claim_id": null,
  "privacy": "public",
  "schema_version": "v1",
  "summary": "Calibration cal-1"
}
