{
  "action_id": "action-pilot-shadow",
  "content_digest": "sha256:e69a5dad142cdd3499c30514f9bc5eade451d7067d49ed61d545ef2c152fce3f",
  "created_at": "2026-07-01T00:00:00Z",
  "evidence_classes": [
    "unchecked_advisory"
  ],
  "external_ref_ids": [],
  "node_class": "admissibility_decision",
  "node_id": "node-admissibility_decision",
  "payload": null,
  "payload_ref": null,
  "pcs_claim_id": null,
  "privacy": "public",
  "schema_version": "v1",
  "summary": "admissibility_decision for action-pilot-shadow"
}
