{
  "action_id": "action-valid-release",
  "content_digest": "sha256:d45d886cbef70b7b6c38009ee7ca24ffcca0a0355d52201a729a4eb56f2d1ee2",
  "created_at": "2026-07-01T00:00:00Z",
  "evidence_classes": [
    "human_reviewed"
  ],
  "external_ref_ids": [],
  "node_class": "review",
  "node_id": "node-review",
  "payload": null,
  "payload_ref": null,
  "pcs_claim_id": null,
  "privacy": "public",
  "schema_version": "v1",
  "summary": "review for action-valid-release"
}
