{
  "action_id": "action-pilot-shadow",
  "content_digest": "sha256:66f261dd4332c429c593dbcd4acdcff9b62ad43897fb528e50c021da3a9e5c51",
  "created_at": "2026-07-01T00:00:00Z",
  "evidence_classes": [
    "unchecked_advisory"
  ],
  "external_ref_ids": [],
  "node_class": "verification_result",
  "node_id": "node-verification_result",
  "payload": null,
  "payload_ref": null,
  "pcs_claim_id": null,
  "privacy": "public",
  "schema_version": "v1",
  "summary": "verification_result for action-pilot-shadow"
}
