{
  "action_id": "action-pilot-shadow",
  "content_digest": "sha256:1afb95c4d85a508e8b6858e2186e38893acd952b41d9074fe5917dccd16c00f3",
  "created_at": "2026-07-01T00:00:00Z",
  "evidence_classes": [
    "human_reviewed"
  ],
  "external_ref_ids": [],
  "node_class": "review",
  "node_id": "node-review",
  "payload": null,
  "payload_ref": null,
  "pcs_claim_id": null,
  "privacy": "public",
  "schema_version": "v1",
  "summary": "review for action-pilot-shadow"
}
