{
  "action_id": "action-pilot-retrospective",
  "content_digest": "sha256:dd33642dc6555a5feb28e4e86d52bc85f9f7419882533604949b6e7f5f90a825",
  "created_at": "2026-07-01T00:00:00Z",
  "evidence_classes": [
    "unchecked_advisory"
  ],
  "external_ref_ids": [],
  "node_class": "claim",
  "node_id": "node-claim",
  "payload": null,
  "payload_ref": null,
  "pcs_claim_id": null,
  "privacy": "public",
  "schema_version": "v1",
  "summary": "claim for action-pilot-retrospective"
}
