{
  "action_id": "action-pilot-shadow",
  "content_digest": "sha256:9b115866bb76d262fafe6bd883727902874cac535f9a332b2d6ecfe17c1fd267",
  "created_at": "2026-07-01T00:00:00Z",
  "evidence_classes": [
    "unchecked_advisory"
  ],
  "external_ref_ids": [],
  "node_class": "proposed_action",
  "node_id": "node-proposed_action",
  "payload": null,
  "payload_ref": null,
  "pcs_claim_id": null,
  "privacy": "public",
  "schema_version": "v1",
  "summary": "proposed_action for action-pilot-shadow"
}
