{
  "action_id": "action-valid-release",
  "content_digest": "sha256:e5db2fc141bc9588ac1a634c823df571f9fc99479374313609cffce8f241a8a1",
  "created_at": "2026-07-01T00:00:00Z",
  "evidence_classes": [
    "unchecked_advisory"
  ],
  "external_ref_ids": [],
  "node_class": "source",
  "node_id": "node-source",
  "payload": null,
  "payload_ref": null,
  "pcs_claim_id": null,
  "privacy": "public",
  "schema_version": "v1",
  "summary": "source for action-valid-release"
}
