{
  "action_id": "action-pilot-shadow",
  "content_digest": "sha256:c26dec6f95fe8b1cedad91aac7c42c953c4cbbaaf1826a67ecaea418d52bc2bc",
  "created_at": "2026-07-01T00:00:00Z",
  "evidence_classes": [
    "human_reviewed"
  ],
  "external_ref_ids": [],
  "node_class": "grant",
  "node_id": "node-grant",
  "payload": null,
  "payload_ref": null,
  "pcs_claim_id": null,
  "privacy": "public",
  "schema_version": "v1",
  "summary": "grant for action-pilot-shadow"
}
