{
  "action_id": "action-valid-release",
  "content_digest": "sha256:efb8ebbdf99d1151c384de5d2b777244b4e58335aaffc3f05a4c72e5437d2d56",
  "created_at": "2026-07-01T00:00:00Z",
  "evidence_classes": [
    "unchecked_advisory"
  ],
  "external_ref_ids": [],
  "node_class": "evidence",
  "node_id": "node-evidence",
  "payload": null,
  "payload_ref": null,
  "pcs_claim_id": null,
  "privacy": "public",
  "schema_version": "v1",
  "summary": "evidence for action-valid-release"
}
