{
  "action_id": "action-pilot-shadow",
  "content_digest": "sha256:bb238e7998f585850849df01559de0d85e664d55ff3a8c8ace391e5fdaa8790d",
  "created_at": "2026-07-01T00:00:00Z",
  "evidence_classes": [
    "human_reviewed"
  ],
  "external_ref_ids": [],
  "node_class": "calibration_update",
  "node_id": "node-calibration-cal-1",
  "payload": null,
  "payload_ref": "calibrations/cal-1.json",
  "pcs_claim_id": null,
  "privacy": "public",
  "schema_version": "v1",
  "summary": "Calibration cal-1"
}
